Gradle	Advantages Of Using Gradle	Gradle combines both Ant and Maven
Gradle	What Is Gradle Wrapper	A wrapper is a batch script and it is one of the ways to perform Gradle build. When executed the first time
Gradle	Why Gradle Is Preferred Over Other Build Tools	Gradle build script is written using groovy API which has the syntax similar to Java so it is easy to understand. Gradle supports ant tasks
Gradle	What Is The Gradle Build Script File Name	build.gradle.
Gradle	What Is The Latest Version Of Gradle Available In The Market	Gradle build tool latest version is 3.5 as of May 2017. The version on your local Gradle installation can be checked using Gradle -v command.
Gradle	How Do You Run Gradle Build	Execute Gradle build using Gradle command.
Gradle	What Are The Core Components Of Gradle Build Script	Project and task are the core components. Groovy organizes projects as a list of tasks.
Gradle	How Do You Find Gradle Project Dependencies	Use the Gradle command Gradle dependencies that list the dependencies of the selected project. It includes both direct and transitive dependencies.
Gradle	The Main Difference Between Maven Build.xml And Build.gradle Script	Maven build.xml is an xml document that includes start and end tags. Build.gradle is a Groovy script which has a syntax similar to Java.
Gradle	How Do I Check Out And Build The Framework	Framework uses a Gradle-based build system. In the instructions below
Gradle	How Long Should A Build Take when Running ./gradlew Build for The first time	A complete ./gradle clean build will take between 5 and 15 minutes depending on your clock and disk speed.
Gradle	How Do I Configure The Gradle Daemon To Speed Up Builds	By exporting a GRADLE_OPTS environment variable that includes -Dorg.gradle.daemon=true
Gradle	Why Are Compile-time Warnings Suppressed	The reason for this is that the framework currently has many warnings
Gradle	What About Publishing Artifacts To Maven Central	This allows for maximum convenience for the majority of Spring users
Gradle	What’s The Overall Roadmap	A subsequent milestone release of Gradle Script Kotlin will ship with the forthcoming Gradle 3.0.
Gradle	Is Using Groovy For My Build Scripts Deprecated	No. Gradle’s Groovy support is not deprecated and will continue to be supported.
Gradle	Will Existing Plugins Still Work When I Write My Build Logic In Kotlin	Yes
Gradle	Do I Have To Use Intellij Idea When Using Kotlin For Gradle	No. Although JetBrains is the company behind IDEA and also the inventor and driving force behind Kotlin
Gradle	In What Language Should I Develop My Plugins	You can develop your plugins in any JVM language
Gradle	How do I force Gradle to download dependencies always	You may refresh dependencies in your cache using the command line option –refresh-dependencies. Also deleting the cached files under ~/.gradle/caches would get the next Gradle to build to download them again.
Gradle	What are a Gradle project and task	Every Gradle build is made up of one or more projects. What a project represents depends on what it is that you are doing with Gradle.
Gradle	What is Gradle Daemon	The Daemon is a long-lived process that helps with the faster build process
Gradle	How Gradle achieves faster performance	Gradle improves build speed by reusing computations from previous builds and also uses cache information.
Gradle	Difference between settings.Gradle & Gradle.properties	The settings.gradle is a Groovy script that defines build related settings and not project related. The Gradle.properties file is a simple Java properties file. It’s a simple key-value store
Gradle	What is Gradle Dependency Management	Gradle Dependency Management involves the programming of dependencies that operate in the form to build projects and Gradle work in a particular path which leads to a unique syntax that termed as dependencies.
Gradle	What is Gradle Multi-Project Build	Gradle is said to be one of the best tools which can handle any tasks irrespective of large or small. The smaller the file is
Gradle	What is Gradle Motto	"The Gradle tool has chosen an idealistic slogan which makes the user believe in a composite framework and the quote says ""Make the impossible possible"
Gradle	What is Gradle Build Environment	The Gradle serves various ways and options that help to build and construct Java to configure it throughout the process of the entire project which will carry out the build.
Maven	What is Maven	Maven provides developers a whole build lifecycle framework. Gather necessities
Maven	What Are the Aspects Maven Managed	Builds
Maven	What Is Pom What Information Does Pom Contain	POM stands for Project Object Model. It’s a basic Unit of work in maven. it’s an XML file.
Maven	What Is Maven Build Lifecycle	A Build Lifecycle is a well-defined sequence of phases that outline the order in which the goals are to be executed
Maven	What Is Maven Artifact	"An artifact is a file, usually a JAR, that gets deployed to a Maven repository. A Maven build produces one or more artifacts, such as a compiled JAR and a ""sources"" JAR. Each artifact has a group ID (usually a reversed domain name, like com.example.foo), an artifact ID (just a name), and a version string."
Maven	What Are the Phases of a Maven Build Lifecycle	Validate
Maven	What is a Maven Repository	A Maven repository is a location where all the plugins
Maven	What is Maven snapshot	A snapshot version of Maven is not a real version and that will not have been released. An equivalent version might get several updates.
Maven	What features should a build tool have	Compile Java code and build jar
Maven	List out the dependency scope in Maven	Compile: it’s the default scope
Maven	How do you know the version of mvn you are using	mvn --version
Maven	What is the command to quickly build your Maven site	mvn site
Maven	What would the command mvn clean do 	This command removes the target directory with all the build data before starting the build process.
Maven	What would this command do mvn clean dependency:copy-dependencies package	This command will clean the project
Maven	What phases does a Clean Lifecycle consist	pre-clean
Maven	What phases does a Site Lifecycle consist	pre-site
Maven	What is Build Profile	A Build profile is a set of configuration values which can be used to set or override default values of Maven build. Using a build profile
Maven	How can you activate profiles	Explicitly using command console input.
Maven	What types of Maven repository	Maven repository are of three types: local
Maven	What is the default location for your local repository	~/m2./repository.
Maven	What is the command to install JAR file in local repository	mvn install
Maven	What are the types of Maven Plugins	Build plugins − They execute during the build and should be configured in the <build/> element of pom.xml
Maven	What is Archetype	Archetype is a Maven plugin whose task is to create a project structure as per its template.
Maven	What is SNAPSHOT in Maven	SNAPSHOT is a special version that indicates a current development copy. Unlike regular versions
Maven	What is transitive dependency in Maven	Transitive dependency means to avoid needing to discover and specify the libraries that your own dependencies require
Maven	Why profile is used in Maven	To give portability to projects ( e.g. windows
Maven	How can you build your project offline	mvn o package.
Maven	How do you exclude dependency	Using the exclusion element.
Maven	What is a system dependency	Dependency with scope system are always available and are not looked up in repository
Maven	What is the use of optional dependency	"Any transitive dependency can be marked as optional using ""optional"" element. As example"
Maven	What is dependency exclusion 	"Any transitive dependency can be exclude using ""exclusion"" element. As example"
Maven	How can you run the clean plugin automatically during the build	You can put the clean plugin inside the execution tag in pom.xml file.
Maven	How to stop the propagation of plugins to child POMs	set <inherited> to false.
DevOps	My deployment is failing	You can check for the reasons of failure in the deployment logs provided and act accordingly.
CDD	What is devops	DevOps is a set of practices that combines software development and information-technology operations which aims to shorten the systems development life cycle and provide continuous delivery with high software quality.
DevOps	where can i see deployment logs	Usually during deployment a log file is created and the logs are logged accordingly
DevOps	what deployment tool being used	Please refer link https://confluence/devopstools
DevOps	Our team wants to shift left, how do we do it ?	Good to see your team is alligning with DevOps ideology, please raise a JIRA ticket so to get an devops coach assigned to assist you
DevOps	What is the Procedure to subscibe a CIPaaS	to begin please create an JIRA ticket, make sure you have an buisness justification for the same.
DevOps	what is the tool you provide to support code quality	Sonar,please contact Secure Development team
DevOps	what is the tool you provide to support code Security	Fortify,please contact Secure Development team
DevOps	what is the tool you provide to support Continous Integration	Jenkins,please contact CIP Squad team
DevOps	what is the tool you provide to support Continous Deployment	CDD is the supported tool,please contact RODA team
DevOps	what is the tool you provide to support Mobile	We provide Centralized CIP to help build,release and sign and upload Android and IOS to respective Stores.
Sonar	sonar report is not generating	Please check the jenkins Build log for more reason for the failure
Sonar	where can i see my sonar report	The Issues Report plugin provides the ability to generate HTML report on issues. The main use case is for developers to check the code they have added or changed before pushing it back to the SCM.
Jenkins	my jenkins build is failing	You can use the Build Failure Analyzer
Jenkins	What is Jenkins	Jenkins is an open source automationtool written in Javawith plugins built for Continuous Integration purpose. It is used for build and deploying of the applications.
Jenkins	Why Jenkins Build is failing	Please provide the error message
Jenkins	Filter Not available	Please use the correct Filter for deploy contact WebHosting team
Jenkins	Param Not Available	Please use the correct Paran for deploy contact WebHosting team
Jenkins	m4.3:release-finish:Error Finishing release	This is possibly due to your Jgit plugin refer the KEDB https://confluence/DevOps/KEDB/Jgit
Jenkins	I am not able to login to Jenkins spaw2479	make sure your INT credentials has not expired, it does once every 3 months
Jenkins	I am not able to login to Jenkins spaw2479	Try both capital and small case of your Int Id to login.
Jenkins	I don't see my project anymore	try to login using both upper and lower case INT id , if it still fails create a JIRA ticket
Jenkins	I can't see my application anymore	try to login using both upper and lower case INT id , if it still fails create a JIRA ticket
Jenkins	500 Bad Gateway when accessing	Your instance possibly is down,Please create an JIRA ticket for the same
Jenkins	Unable to release using JGIT	This is possibly due to your Jgit plugin refer the KEDB https://confluence/DevOps/KEDB/Jgit
Jenkins	Jenkins fails stating Return Code is 400 Reason Phrase:BadRequest	This is possibly your artifact your are uploading already exists in Nexus else you are trying to push a SNAPSHOT to Releases repo which is prohibited
Jenkins	Jenkins fails due to PKIX path building failed unable to find valid certificaiton path to requested target	image used could now be obsolete please use the latest version
CDD	what is CDD	Continuous Deployment is a software development practice in which every code change goes through the entire pipeline and is put into production
CDD	What is meant by continuous deployment	Continuous deploymentis a strategy for software releases wherein any code commit that passes theautomatedtesting phase is automatically released into the production environment
CDD	What is the difference between continuous delivery and continuous deployment in DevOps	Continuous deliveryis an approach which incorporates the conceptsof continuous integration
CDD	What is continuous delivery DevOps	Continuous deliveryis a software development practice where code changes are automatically prepared for a release to production. ...Continuous deliverylets developers automate testing beyond just unit tests so they can verify application updates across multiple dimensions before deploying to customers.
CDD	What is continuous integration and deployment	Continuous Integrationis the practice of testing each change done to your codebase automatically and as early as possible.Continuous Deploymentfollows the testing that happens duringContinuous Integrationand pushes changes to a staging or production system
CDD	Why do I have continuous delivery	Continuous Deliveryreduces waste and makes releases boring .One of the main uses ofcontinuous deliveryis to ensure we are building functionality that really delivers the expected customer value. ... Second
CDD	How do you implement continuous deployment	Continuous Delivery and Deployment
CDD	How does continuous delivery work	Continuous delivery
CDD	What are the benefits for continuous delivery	Top Benefits of Continuous Delivery. Deliver software with fewer bugs and lower risk. When you release smaller changes more frequently
CDD	What is the difference between DevOps and continuous delivery	Difference between DevOps and Continuous Integration. DevOps is a group of procedure and products that empower the continuous delivery to value the end-user. It is the combination of two words Dev & Ops that refers to the development of the multidisciplinary team. ... DevOps is considered as the outcome of agile.
CDD	What is continuous delivery in DevOps	Continuous delivery is a software development practice where code changes are automatically prepared for a release to production. ... Continuous delivery lets developers automate testing beyond just unit tests so they can verify application updates across multiple dimensions before deploying to customers.
CDD	What are the benefits of continuous integration	Continuous Integration (CI) is a development practice that requires developers to integrate code into a shared repository several times a day. Each check-in is then verified by an automated build
CDD	What are the benefits of deployment	These include post deployment health benefits
CDD	What is a business benefit of continuous deployment	CI
CDD	What are the appropriate characteristics of continuous delivery approach	Low risk releases. The primary goal of continuous delivery is to make software deployments painless
Junit	what is junit	JUnit is a unit testing framework for the Java programming language. JUnit has been important in the development of test-driven development
Junit	What is the use of JUnit	JUnit is an open source framework
Junit	What is the JUnit in Java	JUnitis an open source Unit Testing Framework forJAVA. It is useful forJavaDevelopers to write and run repeatable tests. Erich Gamma and Kent Beck initially develop it. It is an instance of xUnit architecture. As the name implies
Junit	What is JUnit and Mockito	Mockito is a popular mock framework which can be used in conjunction with JUnit. Mockito allows you to create and configure mock objects. Using Mockito greatly simplifies the development of tests for classes with external dependencies. If you use Mockito in tests you typically: ... Execute the code under test.
Junit	What is mean by JUnit	JUnit is a unit testing framework for the Java programming language. JUnit has been important in the development of test-driven development
Junit	Why is JUnit important	JUnit is a unit testing framework for the Java Programming Language. It is important in the test driven development
Junit	What is JUnit and how do you use it	JUnit is a unit testing framework for the Java programming language that plays a big role in regression testing. As an open-source framework
Junit	Is TestNG better than JUnit	TestNG is an automated testing framework
Junit	How do I set up JUnit	Verify Java Installation in Your Machine.Set JAVA Environment.Download JUnit Archive.Set JUnit Environment.Set CLASSPATH Variable.Test JUnit Setup.Verify the Result.
Junit	How do I run JUnit	The easiest way of running a single JUnit test method is to run it from within the test case's class editor:Place your cursor on the method's name inside the test class.Press Alt+Shift+X
Junit	What is JUnit in Maven	JUnit( http://junit.org/ ) is open source software
Junit	What is annotation in JUnit	What is JUnit Annotations Annotation is a special form of syntactic meta-data that can be added to Java source code for better code readability and structure. Variables
Junit	Why JUnit is used in selenium	JUnitis an open-source unit testing tool that helps to test units of code. It is mainlyusedfor unit testing Java projects
Junit	What is JUnit and NUnit	NUnit is an evolving
Junit	Is JUnit part of JDK	Neither.JUnitis a third-party project. You can download it here
Junit	What JUnit 5	JUnit 5is the next generation ofJUnit. The goal is to create an up-to-date foundation for developer-side testing on the JVM. This includes focusing on Java 8 and above
Junit	What benefits do JUnit tests provide	Makes the Process Agile. One of the main benefits of unit testing is that it makes the coding process more Agile.Quality of Code. Unit testing improves the quality of the code.Finds Software Bugs Early.Facilitates Changes and Simplifies Integration.Provides Documentation.Debugging Process.Design.Reduce Costs.
Junit	What is JUnit test case	JUnitprovides an annotation called @Test
Junit	Why do we use JUnit in eclipse	Using JUnit in Eclipse.JUnitis a Java library to helpyouperform unit testing. Unit testing is the process of examining a small unit of software (usually a single class) to verify thatitmeets its expectations or specification.
Junit	What is difference between JUnit and TestNG	TestNG supports parallel testing
Junit	What is JUnit and TestNG	BothTestngandJunitare Testing framework used for Unit Testing.TestNGis similar toJUnit. Few more functionalities are added to it that makesTestNGmore powerful thanJUnit. ... Here is the table that shows the features supported byJUnitandTestNG.
Junit	Why TestNG is preferred over JUnit	Advantages & Benefits ofTestNG over Junitframework!TestNGremoves most of the limitations of the older framework and gives the developer the facility to write more powerful and flexible tests with help of easy grouping
Junit	Can we use both TestNG and JUnit	The trick is touse bothframeworks' annotations in the test classes anduse TestNGasserts forJUnitcompatibility. Using this hack
Junit	How do I download JUnit	Verify Java Installation in Your Machine.Set JAVA Environment.Download JUnit Archive.Set JUnit Environment.Set CLASSPATH Variable.Test JUnit Setup.Verify the Result.
Junit	What are the advantages of JUnit	This procedure increases productivity and stability of program code and reduce the time for debugging.JUnitcan catch bugs better than the programmers. Unit testing can prove to be useful. Sometimes a bug is introduced when new features are added or when existing code is changed.
Vmware	What is VMware and what are their benefits?	VMware provides different applications and software for virtualization.  VMware products are categorized into two levels, desktop applications, and Server applications.
Vmware	What are the different types of virtualization available? Network virtualization, Storage virtualization	Different types of virtualization available are Application virtualization, Presentation virtualization,
Vmware	Mention different types of server software do VMware provides?	VMware provides three different types of server software , VMware ESX Server, VMware ESXi Server, VMware Server
Vmware	Explain what is hypervisor	A hypervisor is a program that enables multiple operating systems to share a single hardware host.  Each operating system has the host’s processor, memory and other resources all to itself.  The hypervisor controls the resources and host processor, allocating what is required for each operating system in turn and make sure that the guest operating system cannot disrupt each other.
Vmware	Explain VMware DRS?	VMware DRS stands for Distributed Resource Scheduler; it dynamically balances resources across various host under a cluster or resource pool.  It enables users to determine the rules and policies which decide how virtual machines deploy resources, and these resources should be prioritized to multiple virtual machines.
Vmware	Explain VMware Fault Tolerance?	VMware fault tolerance is an important component of VMware vSphere, and it offers continuous access to applications by preventing data loss and downtime of virtual machines in the event of ESX server failure.
Vmware	What is FT logging traffic?	FT logging is one of the options in VMKernel port setting which is more or less the same as enabling vmotion option in the vmkernel port.
Vmware	Name different components used in VMware infrastructure.	Different components used in VMware infrastructure includes. It consists of the lowest layer which acts as an ESX server host. It also uses the virtual center server which keeps tracks of all the VM associated images and manages it from one point. VMWare infrastructure client, it enables the client to communicate with user’s applications that are running on Vmware.
Vmware	Explain vCloud Suite	Cloud Suite combines with multiple VMware components to give a complete set of cloud infrastructure capabilities in a single package, including virtualization, software-defined datacenter services, disaster recovery, application management, etc.
Vmware	What are the storage and availability in vCloud Suite?	The storage and availability in vCloud Computing Suite includes, Storage DRS:It place and load balance virtual machines based on storage capacity and I/O latency. Storage vMotion:It employs proactive, non-disruptive storage migration to reduce virtual machine storage I/O bottlenecks and free up valuable storage capacity. Application HA:It gains high availability that is bound to specific applications. Data Protection: Based on EMC avamar, it deploys a back-up and recovery tool.
Vmware	What is Host Isolation in VMware HA (High Availability)?	In VMware HA, it has a mechanism to detect a host isolated from the rest of the hosts in the cluster.  In simple words, it uses a heartbeat to communicate another host in the cluster. When the ESX host loses its ability to connect with other hosts in a cluster through heart-beat, then ESX host will be considered as a Host Isolation.
Vmware	What is the difference between VMware HA and Vmware FT?	VMware FT is enabled per VM basis while VMware is enabled per cluster, In the case of ESX host failure, virtual machines are the failed host and are re-started and powered-on the other active hosts in HA cluster. But FT-enabled virtual machines; there is no downtime. In the case of a host failure, the secondary VM will be activated, and it becomes primary and continue to run from the exact point where the primary VM is failed or left off.
Vmware	Explain the new features available in vSphere 5?	In the latest version of vSphere 5.5, it includes, ESXi Hypervisor enhancement, Virtual Machine Enhancement, VMware vCenter Server Enhancement, vSphere storage Enhancement, vSphere Networking Enhancements.
Vmware	What are the new features included in ESXi Hypervisor enhancement?	In ESXi Hypervisor enhancement includes, Hot-pluggable PCIe SSD Devices:It supports SSDs (Solid State Disks) devices, and with a new enhancement, SSD device can be removed or added while a vSphere host is running. Support for Reliable Memory Technology: vSphere ESXi hypervisor can take advantage of new hardware; vendor enabled Reliable Memory Technology, through which a region of memory is reported from the hardware to vSphere ESXi hypervisor. It is used to enhance the placement of VMKernel and other components like initial thread and hosted. It helps to protect against memory error. Enhancements to CPU C-states: A power process (C-state) is used to provide additional power savings.
Vmware	State out the difference between template and clone in Vmware?	Clone is a copy of the virtual machine. A template is a master copy of a virtual machine; it can be used to make many clones.
Vmware	What is Fault Tolerant Logging?	The communication between two ESXI host is known as Fault logging when FT is configured between them.
Vmware	Explain vSS.	VSS stands for Virtual Standard is responsible for communication of VMs hosted on a single physical host. It automatically detects a VM which wants to communicate with other VM on the same physical server.
Vmware	Explain some features of VMware tool	 It offers a simple wizard for setting configuration, Web browser interface, Easy maintenance of virtual machines.
Vmware	Define the term ’VMKenel’.	VMWare Kernel is a proprietary kernel of VMware. It needs an operating system to boot and manage the kernel. A service console is being offered whenever VMWare kernel is booted.
Vmware	What is the purpose of using  Virtual Machine Port Group?	 Virtual Machine port group helps for Virtual machine communication.
Vmware	Give three reasons for using VMware Workstation.	Three reasons for using VMware workstation are: Enables the user to run more than one operating system on a single system, Saves the existing OS configuration in the form of virtual machines. Allows you to work on different OS without switching between them.
