Fortify	How long does Fortify take	There is no set amount of time to move through Fortify. The training can be explored in whatever time frame feels comfortable. We provide a 12-week pathway as one option. We encourage people to take whatever time they need - and not to rush or go too fast. Participation in the Daily Tracker: webinars: forums: groups and in personalized coaching are open-ended – and can go as long as someone needs.
Fortify	How do I get in touch with the Fortify team	Send us a note! We're reachable at info@joinfortify.com. After logging in: you can also find us in the bottom left corner anytime you need. We look forward to hearing from you.
Fortify	How does Fortify ensure that my subscription is anonymous	Fortify does not: nor would not: share any user information – with industry standard data security protections in place. At sign-up: all we need connected to you personally is a working email address. You can use a pseudonym if you prefer. The username you create upon signing up also doesn't have to identify you in any way and will be the only way the community will see you. If you sign-up for a Fortify group or coach: they will only know you by your custom username as well. Lastly: your bank statements will show charges from Impact Collective: LLC not Fortify.
Fortify	How do I speed up management inside EC2	Don't try to manage a fleet of EC2 machines from your laptop. Connect to a management node inside EC2 first and run Ansible from there.
Fortify	How can I know if Fortify is right for me	Try it out for yourself! One of the purposes of the free basic access is to give people a chance to experience Fortify directly for themselves and see if it feels like a good fit We respect that there are many other kinds of supports that may also be very helpful In fact we mention many of them within Fortify to encourage people to look around for anything that can be personally impactful We definitely want you to go with what is right for you!
Fortify	Getting the error WebInspect is not a valid scan database	Choose another database
Fortify	How to sort reports in descending order	This seems to be wor0king: https://fortifydellcom/ssc/api/v1/dataExportslimit=10&start=0&orderby=-exportDate
Ansible	How can I set the PATH or any other environment variable for a task or entire playbook	Setting environment variables can be done with the environment keyword. It can be used at task or play level.
Ansible	How do I handle different machines needing different user accounts or ports to log in with	Setting inventory variables in the inventory file is the easiest way.You may also wish to keep these in group variables instead
Ansible	How do I configure a jump host to access servers that I have no direct access to	With Ansible 2
Ansible	How do I handle python pathing not having a Python 2.X in /usr/bin/python on a remote machine	While you can write ansible modules in any language
Ansible	What is the best way to make content reusable/redistributable	If you have not done so already
Ansible	Where does the configuration file live and what can I configure in it	See Configuration file at https://docs.ansible.com/ansible/2.3/intro_configuration.html.
Ansible	How do I disable cowsay	If cowsay is installed
Ansible	How do I see a list of all of the ansible_ variables	Ansible by default gathers facts about the machines under management
Ansible	How do I see all the inventory vars defined for my host	You can see the resulting vars you define in inventory running the following command: ansible -m debug -a var=hostvars['hostname'] localhost.
Ansible	How do I access a variable name programmatically	An example may come up where we need to get the ipv4 address of an arbitrary interface
Ansible	How do I access a variable of the first host in a group	Here is a small trick: {{ hostvars[groups['webservers'][0]]['ansible_eth0']['ipv4']['address'] }}.
Ansible	How do I copy files recursively onto a target host	The copy module has a recursive parameter
Ansible	How do I access shell environment variables	If you just need to access existing variables
Ansible	How do I generate crypted passwords for the user module	The mkpasswd utility that is available on most Linux systems is a great option: mkpasswd --method=sha-512.
Ansible	Can I get training on Ansible	Yes! See our services page for information on our services and training offerings. Email info@ansible.com for further details.
Ansible	Is there a web interface / REST API / etc	Yes! Ansible
Ansible	How do I submit a change to the documentation	Great question! Documentation for Ansible is kept in the main project git repository
Ansible	How do I keep secret data in my playbook	If you would like to keep secret data in your Ansible content and still share it publicly or keep things in source control
Ansible	Why don't you ship in X format	Several reasons
Ansible	How do I get the original ansible_host when I delegate a task	As the documentation states
Ansible	How do I fix 'protocol error: filename does not match request' when fetching a file	Newer releases of OpenSSH have a bug in the SCP client that can trigger this error on the Ansible controller when using SCP as the file transfer mechanism failed to transfer file to /tmp/ansible/file.txt\r\nprotocol error: filename does not match request
Ansible	Which Python does Ansible use	Currently Ansible can be run from any machine with Python 2 (version 2.7) or Python 3 (versions 3.5 and higher) installed. Windows isn't supported for the control node. This includes Red Hat
Ansible	Does Ansible use Paramiko	The paramiko transport is provided because many distributions
Ansible	Does Ansible need to be installed on remote host	Before we can run ansible commands
Ansible	What is Cowsay in Ansible	ansible. Most systems management programs do not have super-cow powers. ... Ansible has a small easter egg that solves this problem. First off
Ansible	Is Ansible written in Python	Ansible is written in Python
Ansible	Does Ansible support Python 3	Ansible 2.2 features a tech preview of Python 3 support. This topic discusses how you can test to make sure your modules and playbooks work with Python 3. Ansible supports Python version 3.5 and above only.
Ansible	What is the latest version of Ansible	Please refer official Ansible website for this information.
Ansible	Does Ansible use SSH config	By default
Ansible	What port does Ansible use	Ansible change ssh port in playbook.
Ansible	Why do we use Ansible	Ansible is an open source IT configuration management
Ansible	Does Redhat own Ansible	Ansible was written by Michael DeHaan and acquired by RedHat in 2015.
Ansible	What is Ansible galaxy	Ansible Galaxy refers to the Galaxy website where users can share roles and to a command line tool for installing creating and managing roles.
Ansible	What is .retry file in Ansible	When Ansible has problems running play against a host
Ansible	What is the default Forks value in configuration file in Ansible	The fork is the default parallel number of the process while communication to remote nodes. The default value is 5. This number cam be increased form 5 to 500 depending on the ansible node configuration.
Ansible	Which module can be use to copy files from remote machine to control machine	Ansible Copy command. It allows you to copy files and folders from the local machine to remote servers.
Ansible	Where are Ansible Playbooks stored	All hosts are stored in a local Ansible inventory file called /etc/ansible/hosts.
Ansible	What is notify in Ansible	Handlers are just like regular tasks in an Ansible playbook
Ansible	Will Ansible work with Jenkins	Yes it can be used in a CI/CD process to provision the target environment and to then deploy the application on it.
Ansible	Which is better Ansible or puppet	Puppet is more of a configuration management tool
Ansible	What is privilege escalation in Ansible	Ansible can use existing privilege esccalation systems to allow a user to execute tasks as another.
Ansible	What user does Ansible run as	Ansible does not require a master node.
Ansible	Is ansible free	Yes
SVN	Do I need Admin privileges to install TortoiseSVN	Yes: you need to have Admin privileges to install TortoiseSVN: or at least have the rights to install with Admin privileges.
SVN	Do I need to install Subversion before I can use TortoiseSVN	No. TortoiseSVN comes with everything you need to access a repository. Only if you want to set up a server then you will need the Subversion package.
SVN	What is Fork a repo	A fork is a copy of a repository. Forking a repository allows you to freely experiment with changes without affecting the original project.
SVN	What are the Supported browsers for GitHub	We design GitHub to support the latest web browsers. We support the current versions of Chrome: Firefox: Safari: and Microsoft Edge.
SVN	What is the difference between GIT and SVN repository	 The difference between SVN and GIT is# Git does not support commits across multiple branches or tags Subversion allows the creation of folders at any location in the repository layout Gits are unchangeable while subversion enables committers to treat a tag a branch and to create multiple revisions under a tag root Git is less preferred for handling large files or frequently changing binary files while SVN is capable of handling multiple projects stored in the same repository
SVN	List out what all things should be stored in the SVN repository	 Source Code# Build scripts# Test data used by QA# DB schema# Project settings (When the whole team is using the same IDE)# Project documentation (Internal and External)# Minutes of meetings# significant e-mails# and info from the web# Expensively generated artifacts# And other documents related to the project
SVN	What is the command to add a file or dir	 svn add filename and svn add dirname
SVN	List out the common subversion commands	 Import Checkout Commit Update
SVN	What is the difference between commit and update	 Update is used to update the local workspace with the changes made by the team to the repository# while commit is the process to implement changes from local to repository# in simple words# upload a file into the repository
SVN	Explain how you can apply a patch in SVN	 To apply a patch in SVN# you are required to Create Patch by making changes and generating the diff file  Then this diff file can be implemented to the new code base using Apply Patch
SVN	What is the command to create a new directory under version control	 svn mkdir directory# svn mkdir http://url/directory
SVN	How you can import your existing directory into the new repository	 The command you will use to import your existing directory into the new repository you have to write# svn import/home/mysurface/programming file:///home/mysurface/repo/programing_repo-m initial import
SVN	What is the command to see what is inside the repository	 Command svn list file:///home/mysurface/repo/programming_repo is used to see what is inside the repository
SVN	What is the command to view the difference between the local version and repository version	 The command used to view the difference between the local and repository version is# svn diff filename# svn diff dirname
SVN	Mention what does the result codes G and R in svn indicates	 The result codes G and R in svn indicates # G code: Changes on the repo were automatically merged into the working copy# R code: This code indicates that the item has been replaced in your working copy This means the file was programmed or scheduled for deletion# and a new file with the same name was scheduled for addition in its place
SVN	Mention what is the function of Revert in subversion	  Revert function will remove your local changes and reload the latest version from the repository
SVN	Explain how you can revert to a previous version	 To retrieve a previous version# you have to use revert command But revert command will simply erase local edits# what you actually need is to merge command For example# you have a file [abctxt] and the current version is 101# and you want version 201 Then you will use the command like svn merge r 101:201 abctxt svn commit m Reverted to revision 201 abctxt
SVN	Which commands can be used to move some subset of code and history of this code from one SVN repo to another	 Following commands can be used svnadmin dump svndumpfilter include svnadmin load svn remove
SVN	List out what is the best practices for SVN	 Update and Test before commit Work from your own local workspace Commit small autonomous changes Validate the files you are committing# you actually changed Keep in touch with repository Watch for conflicts Always group your check-in logically Use comment
SVN	Explain what checkout command is and how to use the checkout command in SVN	 Check-Out command in SVN is used to create a local workable copy of your project retrieved from the local repository For example# you have a project located in the repository created at URL location http://wwwguru99com/svn/myrepo/myproject  So you have to checkout myproject into your local system assuming myrepo is a public repository You will use code svn co http://wwwguru99com/svn/myrepo/myproject  This command will copy all your files to your current directory If you want checkout the directory which is in a private repository# you will then use the following command svn co http://wwwguru99com/svn/privaterepo/myproject username admin password admin
SVN	Explain the terminologies trunk batch and tag	 Trunk: it is a mainstream of development present in SVN repository created at the start and exists till the end of a project Branch: it is copy derived from a trunk It flows in direction of certain changes without disturbing other users Multiple branches can be created each having its own path of code changes for different functionalities Tag: display milestones in the repository history section# where major changes are done or points where code revision is done
SVN	Why revert command is used in subversion	 Local Revert: it removes the changes done recently that are done after update command is run and before those changes are committed in a repository Repo Revert: it removes changes done on a repository level
SVN	How to check the content of a repository	 In SVN you can see the tree structure of all the directories# folders# files present under any given repository There are subversion commands that help in this
SVN	Is it possible to add a file directly in the repository 	 Yes# the same is possible and the users can go ahead with the command svn add filename and svn add dirname
SVN	Can you tell how in Subversion how the command commit can be put separated from the command update	 When it comes to updating the local workspace# the command which is used often is Update It reflects all the modifications made to the document by any member of the team On the other side# the Commit make sure to implement properly the same modifications made to the data from present location to the repository It can also be said that it simply upload the files and the documents in the repository without making the users to made any sort of efforts
SVN	Why do you think there is a need to made changes to the files documents or the source codes in businesses	 business management is itself a very vast term There are tasks and decisions that are properly based on data and information When it comes to executing them# businesses often test them in different manners The reports are generated accordingly and the new outcomes achieved are often considered and is clubbed with the existing information Thus# the changes to the documents# files and source code are frequent In other words# any sort of changes are made because of no other reason but the betterment of the business
SVN	In Subversion is it possible for the users to apply a patch directly in a subsection without taking the entire document into consideration	 The same is possible and there are certain methods to keep up the pace for this The users are always in a position to get the things done in the shortest possible time On the best methods for this is to create a patch This can be done with the help of diff file The same can then be considered in the new code base and the user are free to make use of the command Apply Patch for this
SVN	Suppose you need to verify what exactly is present inside a repository how you will do this	 Execute the following command for this svn list file
SVN	How the file from the svn repo can be erased	 svn delete filename
SVN	By making use of a single command can you list the entire COS in SVN	 Yes# there are some dedicated commands available for the same One that you can execute is Ct lsco-me
Docker	Can I control service startup order	 Yes ! it is possible
Docker	Can I use json instead of yaml for my Compose file	 Yes Yaml is a superset of json so any JSON file should be valid Yaml
Docker	What is Dockerapp	 Dockerapp is Docker for Mac which is a bundle of Docker client and Docker Engine
Docker	What is HyperKit	 HyperKit is a hypervisor built on top of the Hypervisorframework in macOS
Docker	What is the benefit of HyperKit	 It is thinner than VirtualBox and VMWare fusion and the version we include is tailor made for Docker workloads on the Mac
Docker	How much does Docker cost	 Docker is 100% freeIt is open source
Docker	Does Docker run on Mac OS X or Windows	 Not at this time Docker currently only runs on Linux but you can use VirtualBox to run Docker in a virtual machine on your box
Docker	What is a Docker image	 Docker image is the source of Docker container In other words Docker images are used to create containers
Docker	What is Docker container	 Docker containers include the application and all of its dependencies but share the kernel with other containers running as isolated processes in user space on the host operating system Docker containers are not tied to any specific infrastructure: they run on any computer on any infrastructure and in any cloud
Docker	What is the difference between the COPY and ADD commands in a Dockerfile	 COPY is same as ADD but without the tar and remote URL handling
Docker	How to force Docker for a clean build of an image	 There's a --no-cache option: docker build --no-cache -t u12_core -f u12_core
Docker	How can I expose more than 1 port with Docker	 To expose multiple ports simply provide multiple -p arguments: docker run -p <host_port1>:<container_port1> -p <host_port2>:<container_port2>
Docker	How to view docker daemon when OS is using systemd	 sudo journalctl -fu dockerservice
Docker	What is Docker Swarm	 Docker Swarm is native clustering for Docker It turns a pool of Docker hosts into a single & virtual Docker host
Docker	What command should you run to see all running container in Docker	 $ docker ps
Docker	What is the command to stop the docker container	 $ sudo docker stop container name
Docker	What is the command to run the image as a container	 $ sudo docker run -i -t alpine /bin/bash
Docker	What are the common instruction in Dockerfile	 The common instruction in Dockerfile are: FROM - LABEL - RUN and CMD
Docker	Where the docker volumes are stored	 You need to navigate:  /var/lib/docker/volumes
Docker	How does communication happen between Docker client and Docker Daemon	 You can communicate between Docker client and Docker Daemon with the combination of Rest API / socketIO and TCP
Docker	What is the command you need to give to push the new image to Docker registry	 docker push myorg/img
Docker	How can you run multiple containers using a single service	 By using docker-compose you can run multiple containers using a single service All docker-compose files uses yaml language
Docker	What are the three components of Docker Architecture	 1Client 2Docker-Host 3Registry
Docker	What is the purpose of Docker_Host	 It contains container/ images / Docker daemon It offers a complete environment to execute and run your application
Docker	Does Docker offer support for IPV6	 Yes! Docker provides support IPv6 IPv6 networking is supported only on Docker daemons runs on Linux hosts However if you want to enable IPv6 support in the Docker daemon you need to modify /etc/docker/daemonjson and set the ipv6 key to true
Docker	What are Docker Namespaces	The Namespaces in Docker is a technology which provides isolated workspaces called the Container. Namespaces provide a layer of isolation for the Docker containers
Docker	What is a Docker Swarm	Docker Swarm as the way of orchestrating the Docker containers
Docker	Is it possible to use JSON instead of YAML for Docker Compose	Yes! It's possible
Docker	What are the most common instructions in Dockerfile	FROM
Docker	How to monitor the docker in production environments	Docker stats and Docker Events
Docker	Where does the docker daemon store the Docker images	Docker Registry
Docker	What are the various states of the Docker container	Four States: Running
Docker	How to start containers automatically	We need to use restart policy …example …docker run always
Docker	What is Docker object labels	These are the mechanism for applying metadata to docker objects including
Docker	How to publish the image	docker push username/repository:tag
Docker	How to scale the app	By changing the replicas value in docker compose.yml and re run the command docker stack deploy
Docker	How to install Docker	yum install docker
Docker	What is the docker inspect do	It will give the more information about container in json format
Docker	How to start Docker daemon	dockerd [options]
Docker	How to check the container status	docker ps
Docker	How you create jenkins image using Docker	Docker pull jenkins
Docker	What is the Docker container life cycle	Build
Docker	How to clean up Docker objects	docker image prune and docker container prune
Docker	How to push the new image to Docker registry	docker push myorg/myimg
Docker	Image java.io.IOException docker invalid reference format	Please check the image reference could be an obsolete version
Docker	No Space left	Check http://confluence/CleanUpDiskSpace
Docker	Libz.so.1	sudo moung /tmp-o remount,execute
Nexus	What is a nexus repository	Nexus is a repository manager. It allows you to proxy
Nexus	how to push the artifacts to nexus	Please follow the link http://confluence/howtopushtonexus
Nexus	Is Nexus repository free	If so
Nexus	How do I download from Nexus repository	"Go to Views/Repositories -> Repositories. Select the Maven Central repository and click on the Configuration tab. Set ""Download Remote Indexes"" to true and click on Save. Nexus will then download the repository index from the remote repository."
Nexus	What is Nexus tool	Nexus Repository OSS is an open source repository that supports many artifact formats
Nexus	What is the purpose of Nexus	Nexus is a framework for developing and sustaining scaled product and software delivery initiatives. It uses Scrum as its building block. This Guide contains the definition of Nexus. This definition consists of Nexus roles
Nexus	How do I create a nexus repository	Open the Nexus Repository Manager user interface.Click Administration in the top navigation menu
Nexus	Is Nexus repository open source	Are you developing an open source project If so
Nexus	What is Nexus lifecycle	In just minutes
Nexus	What is Nexus tool in Devops	Nexus Repository OSS is an open source repository that supports many artifact formats
Nexus	What is a artifact repository	An artifact repository manages your end-to-end artifact lifecycle and supports different software package management systems while providing consistency to your CI/CD workflow. An artifact repository is both a source for artifacts needed for a build
Nexus	What is Nexus platform	Sonatype Nexus Platform is comprised of multiple products which contribute to the Sonatype Nexus security capabilities. ... In the application security space
Nexus	What is the difference between Nexus and Artifactory	Storage: Nexus uses file system to store artifacts and metadata
Nexus	How do I use Nexus repository	Step 1: Download. Download Nexus from here (at the time of writing
Nexus	In which default port number does Nexus run	You will need to change your Nexus server to listen to a different port or IP address. The default behavior of Nexus is to attempt to bind to port 8081 or 0.0.0.0 (or every available interface)
Nexus	How do I add a jar to my Nexus repository	"Click on ""Browse Repositories"
Nexus	What is Nexus proxy	A Nexus installation brings you such a repository for your company. So you can host your own repositories
Nexus	How do I change nexus port	To change the NEXUS default port:Stop Nexus.Edit the nexus.properties file. In this example
Nexus	What is hosted repository in Nexus	A Hosted Repository is a repository that is hosted by the repository manager. Nexus Repository Manager ships with the following configured hosted repositories: 3rd Party. This hosted repository can be used for third-party dependencies not available in the public Maven repositories.
Nexus	What is raw repository in Nexus	Introduction. Nexus Repository Manager Pro and Nexus Repository Manager OSS include support for hosting
Nexus	Is Nexus 2 High Available	No
Nexus	Is there a scheduled downtime for Nexus 2	Yes ! it is possible
Nexus	When is Nexus 2 down during the week	Saturday 1 AM to 5 AM
Nexus	Is Nexus 2 and Nexus 3 same?	No, Nexus 2 is production instance while Nexus 3 is target
Nexus	Can I store docker images in Nexus 3	Yes Nexus 3 (central repo) is capable of hosting docker registry
Nexus	Can i upload artifacts to Nexus?	No you can upload only via a technical user via one of the automation tools
Nexus	Can i get access to Nexus?	 No,Individual access is not granted, however Nexus 2 provides anonymous access to download artifacts
Nexus	What's the nexus URL	https://inet-prodnexus/nexus
Nexus	what is GAV?	Group Artifact and Version that uniquely identifies an artifact under Nexus
Gradle	What Is a Gradle Framework	Gradle is an open-source build automation system that builds based on the concepts of Apache Ant and Apache Maven.
